B1: How we change what others think, feel, believe and do

A1: | Menu | Quick | Books | Share | Search | Settings |

A1: Independent-measures t-test Explanations > Social Research > Analysis > Independent-measures t-test Description | Example | Discussion | See also Description The t-test gives an indication of the separateness of two sets of measurements, and is thus used to check whether two sets of measures are essentially different (and usually that an experimental effect has been demonstrated). The independent-measures t-test (or independent t-test) is used when measures from the two samples being compared do not come in matched pairs. It is used when groups are independent and all people take only one test (typically a post-test). In design notation, this is: The requirement for Variance homogeneity test may be measured with Levene's test. Results for this can be given in SPSS along with the t-test results. Calculation The value of t may be calculated using packages such as SPSS. The actual calculation for two groups is: t = experimental effect / variability = difference between group means / standard error of difference between group means = Dg / SEg Dg = AVERAGE(Xt) - AVERAGE(Xc) where Xt are the measures in the treatment group and Xc are the measures in the control group. Note that any minus sign is removed, so that 't' remains positive. SEg = SQRT( VAR(Xt)/nt + VAR(Xc)/nc) where n is the number of people in the group and VAR(X) is the variance of X. VAR(X) = SUM((X-AVERAGE(X))2)/(n-1) A single group can also be compared with a measure, M, taken elsewhere. t = (AVERAGE(X) - M) / (STDEV(X) / SQRT(n) ) Where STDEV(X) is the standard deviation of the group. Interpretation The resultant t-value is then looked up in a t-test table to determine the probability that a significant difference between the two sets of measures exists and hence what can be claimed about the efficacy of the experimental treatment. Effect The t-value can also be converted to an r-value to measure effect, which can be calculated as: r = SQRT( t2 / (t2 + DF)) where DF is the degrees of freedom. In a t-test, DF = N1 + N2 - 2. Example The results of two sets of measures are as follows: Looking up the t-value in the t-test table, with degrees of freedom = 15+15-2 = 28, the whole row is greater than t (0.32) so no significance can be claimed. Discussion If the samples can be matched, such as in before-and-after measurement, then you should use the matched-pair t-test. See also Matched-pair t-test

A1: R | B1: X | C1: O
A2: R | C2: O

B1: X1 | C1: X2 | E1: (X1-X1-bar)^2 | F1: (X1-X2-bar)^2
B2: 5.24 | C2: 7.53 | E2: =(B2-B$22)^2 -> 30.918784239652748 | F2: =(C2-C$22)^2 -> 22.658885439879167
B3: =B2+RAND()*1.5 -> 6.3311744784025779 | C3: =C2+RAND()*1.5 -> 8.4683078685926922 | E3: =(B3-B$22)^2 -> 19.974568394929694 | F3: =(C3-C$22)^2 -> 14.606362800323174
B4: =B3+RAND()*1.5 -> 6.4449624272834471 | C4: =C3+RAND()*1.5 -> 9.8050988188466484 | E4: =(B4-B$22)^2 -> 18.970413018828797 | F4: =(C4-C$22)^2 -> 6.1754049373561521
B5: =B4+RAND()*1.5 -> 7.2739722613574695 | C5: =C4+RAND()*1.5 -> 9.8075872344088335 | E5: =(B5-B$22)^2 -> 12.436159422105892 | F5: =(C5-C$22)^2 -> 6.1630435240407397
B6: =B5+RAND()*1.5 -> 8.4522245455243841 | C6: =C5+RAND()*1.5 -> 9.9215946893896252 | E6: =(B6-B$22)^2 -> 5.5142388164235792 | F6: =(C6-C$22)^2 -> 5.6099833132766168
B7: =B6+RAND()*1.5 -> 9.14227566193426 | C7: =C6+RAND()*1.5 -> 10.358339030004986 | E7: =(B7-B$22)^2 -> 2.7495958242415801 | F7: =(C7-C$22)^2 -> 3.7318357596424416
B8: =B7+RAND()*1.5 -> 10.415792471756115 | C8: =C7+RAND()*1.5 -> 11.444788919108976 | E8: =(B8-B$22)^2 -> 0.1479738687825429 | F8: =(C8-C$22)^2 -> 0.71461003584108451
B9: =B8+RAND()*1.5 -> 11.747879609407786 | C9: =C8+RAND()*1.5 -> 12.923546569663458 | E9: =(B9-B$22)^2 -> 0.89759218905963789 | F9: =(C9-C$22)^2 -> 0.40121018708891787
B10: =B9+RAND()*1.5 -> 12.40707083254425 | C10: =C9+RAND()*1.5 -> 13.555945660371115 | E10: =(B10-B$22)^2 -> 2.5811784804728646 | F10: =(C10-C$22)^2 -> 1.6022765689670897
B11: =B10+RAND()*1.5 -> 12.759449625803041 | C11: =C10+RAND()*1.5 -> 13.604437353931827 | E11: =(B11-B$22)^2 -> 3.8376161054429812 | F11: =(C11-C$22)^2 -> 1.7273906163506711
B12: =B11+RAND()*1.5 -> 13.281206702665232 | C12: =C11+RAND()*1.5 -> 13.858816487287493 | E12: =(B12-B$22)^2 -> 6.1540734958542576 | F12: =(C12-C$22)^2 -> 2.4607615355133481
B13: =B12+RAND()*1.5 -> 13.615741771420462 | C13: =C12+RAND()*1.5 -> 14.055858416261961 | E13: =(B13-B$22)^2 -> 7.9257766046485498 | F13: =(C13-C$22)^2 -> 3.1177791005154614
B14: =B13+RAND()*1.5 -> 14.307300568286207 | C14: =C13+RAND()*1.5 -> 15.035153469683259 | E14: =(B14-B$22)^2 -> 12.29788736333969 | F14: =(C14-C$22)^2 -> 7.5351262710813094
B15: =B14+RAND()*1.5 -> 14.754389825815007 | C15: =C14+RAND()*1.5 -> 16.438659036113428 | E15: =(B15-B$22)^2 -> 15.633512125308922 | F15: =(C15-C$22)^2 -> 17.210251485036149
B16: =B15+RAND()*1.5 -> 15.833552053663778 | C16: =C15+RAND()*1.5 -> 17.54389179557084 | E16: =(B16-B$22)^2 -> 25.331953320498524 | F16: =(C16-C$22)^2 -> 27.601960222367268
A18: n | B18: =COUNT(B2:B16) -> 15 | C18: =B18 -> 15 | D18: Sum: | E18: =SUM(E2:E16) -> 165.37132326959025 | F18: =SUM(F2:F16) -> 121.31688179727959
A19: df = n-1 | B19: =B18-1 -> 14 | C19: =C18-1 -> 14 | D19: Variance: | E19: =E18/($B$18-1) -> 11.812237376399304 | F19: =F18/($B$18-1) -> 8.6654915569485418
B21: X1-bar | C21: X2-bar | D21: Std Error: | E21: =SQRT((E19+F19)/B18) -> 1.1684100003380049
A22: Mean: | B22: =AVERAGE(B2:B16) -> 10.8004661890576 | C22: =AVERAGE(C2:C16) -> 12.290135023282341
A24: t : | B24: =ABS(B22-C22)/E21 -> 1.2749538550626922

A1: if (document.getElementById("tester") == undefined) { document.write('<p>&nbsp;</p><h3 align="center">To keep this site going, please allow adverts or donate</h3>'); document.write('<form action="https://www.paypal.com/cgi-bin/webscr" method="post" target="_top" align="center">'); document.write('<input type="hidden" name="cmd" value="_s-xclick">'); document.write('<input type="hidden" name="hosted_button_id" value="RHDQ3VJH93RDE">'); document.write('<input type="image" src="https://www.paypalobjects.com/en_US/GB/i/btn/btn_donateCC_LG.gif" border="0" name="submit" alt="PayPal ? The safer, easier way to pay online.">'); document.write('<img alt="" border="0" src="https://www.paypalobjects.com/en_GB/i/scr/pixel.gif" width="1" height="1">'); document.write('</form>'); } (adsbygoogle = window.adsbygoogle || []).push({});

A1: Site Menu
A2: | Home | Top | Quick Links | Settings |
A3: Main sections: | Disciplines | Techniques | Principles | Explanations | Theories |
A4: Other sections: | Blog! | Quotes | Guest articles | Analysis | Books | Help |
A5: More pages: | Contact | Caveat | About | Students | Webmasters | Awards | Guestbook | Feedback | Sitemap | Changes |
A6: Settings: | Computer layout | Mobile layout | Small font | Medium font | Large font | Translate |

A1: You can buy books here
A3: And the big paperback book

A1: More Kindle books:

A1: Look inside

A1: Please help and share:

A1: if (document.getElementById("tester") == undefined) { document.write('<p>&nbsp;</p><h3 align="center">To keep this site going, please allow adverts or donate</h3>'); document.write('<form action="https://www.paypal.com/cgi-bin/webscr" method="post" target="_top" align="center">'); document.write('<input type="hidden" name="cmd" value="_s-xclick">'); document.write('<input type="hidden" name="hosted_button_id" value="RHDQ3VJH93RDE">'); document.write('<input type="image" src="https://www.paypalobjects.com/en_US/GB/i/btn/btn_donateCC_LG.gif" border="0" name="submit" alt="PayPal ? The safer, easier way to pay online.">'); document.write('<img alt="" border="0" src="https://www.paypalobjects.com/en_GB/i/scr/pixel.gif" width="1" height="1">'); document.write('</form>'); } (adsbygoogle = window.adsbygoogle || []).push({});

A1: Quick links
A2: Disciplines * Argument * Brand management * Change Management * Coaching * Communication * Counseling * Game Design * Human Resources * Job-finding * Leadership * Marketing * Politics * Propaganda * Rhetoric * Negotiation * Psychoanalysis * Sales * Sociology * Storytelling * Teaching * Warfare * Workplace design Techniques * Assertiveness * Body language * Change techniques * Closing techniques * Conversation * Confidence tricks * Conversion * Creative techniques * General techniques * Happiness * Hypnotism * Interrogation * Language * Listening * Negotiation tactics * Objection handling * Propaganda * Problem-solving * Public speaking * Questioning * Using repetition * Resisting persuasion * Self-development * Sequential requests * Storytelling * Stress Management * Tipping * Using humor * Willpower | B2: Principles * Principles Explanations * Behaviors * Beliefs * Brain stuff * Conditioning * Coping Mechanisms * Critical Theory * Culture * Decisions * Emotions * Evolution * Gender * Games * Groups * Habit * Identity * Learning * Meaning * Memory * Motivation * Models * Needs * Personality * Power * Preferences * Research * Relationships * SIFT Model * Social Research * Stress * Trust * Values Theories * Alphabetic list * Theory types And – About – Guest Articles – Blog! – Books – Changes – Contact – Guestbook – Quotes – Students – Webmasters

A1: | Home | Top | Menu | Quick Links |

A1: function googleTranslateElementInit() { new google.translate.TranslateElement({pageLanguage: 'en'}, 'google_translate_element'); }

A1: if (document.getElementById("tester") == undefined) { document.write('<p>&nbsp;</p><h3 align="center">To keep this site going, please allow adverts or donate</h3>'); document.write('<form action="https://www.paypal.com/cgi-bin/webscr" method="post" target="_top" align="center">'); document.write('<input type="hidden" name="cmd" value="_s-xclick">'); document.write('<input type="hidden" name="hosted_button_id" value="RHDQ3VJH93RDE">'); document.write('<input type="image" src="https://www.paypalobjects.com/en_US/GB/i/btn/btn_donateCC_LG.gif" border="0" name="submit" alt="PayPal ? The safer, easier way to pay online.">'); document.write('<img alt="" border="0" src="https://www.paypalobjects.com/en_GB/i/scr/pixel.gif" width="1" height="1">'); document.write('</form>'); } (adsbygoogle = window.adsbygoogle || []).push({});

A1: Site Menu
A2: | Home | Top | Quick Links | Settings |
A3: Main sections: | Disciplines | Techniques | Principles | Explanations | Theories |
A4: Other sections: | Blog! | Quotes | Guest articles | Analysis | Books | Help |
A5: More pages: | Contact | Caveat | About | Students | Webmasters | Awards | Guestbook | Feedback | Sitemap | Changes |
A6: Settings: | Computer layout | Mobile layout | Small font | Medium font | Large font | Translate |

A1: Please help and share:

A1: if (document.getElementById("tester") == undefined) { document.write('<p>&nbsp;</p><h3 align="center">To keep this site going, please allow adverts or donate</h3>'); document.write('<form action="https://www.paypal.com/cgi-bin/webscr" method="post" target="_top" align="center">'); document.write('<input type="hidden" name="cmd" value="_s-xclick">'); document.write('<input type="hidden" name="hosted_button_id" value="RHDQ3VJH93RDE">'); document.write('<input type="image" src="https://www.paypalobjects.com/en_US/GB/i/btn/btn_donateCC_LG.gif" border="0" name="submit" alt="PayPal ? The safer, easier way to pay online.">'); document.write('<img alt="" border="0" src="https://www.paypalobjects.com/en_GB/i/scr/pixel.gif" width="1" height="1">'); document.write('</form>'); } (adsbygoogle = window.adsbygoogle || []).push({});

A1: Quick links
A2: Disciplines * Argument * Brand management * Change Management * Coaching * Communication * Counseling * Game Design * Human Resources * Job-finding * Leadership * Marketing * Politics * Propaganda * Rhetoric * Negotiation * Psychoanalysis * Sales * Sociology * Storytelling * Teaching * Warfare * Workplace design Techniques * Assertiveness * Body language * Change techniques * Closing techniques * Conversation * Confidence tricks * Conversion * Creative techniques * General techniques * Happiness * Hypnotism * Interrogation * Language * Listening * Negotiation tactics * Objection handling * Propaganda * Problem-solving * Public speaking * Questioning * Using repetition * Resisting persuasion * Self-development * Sequential requests * Storytelling * Stress Management * Tipping * Using humor * Willpower | B2: Principles + Principles Explanations * Behaviors * Beliefs * Brain stuff * Conditioning * Coping Mechanisms * Critical Theory * Culture * Decisions * Emotions * Evolution * Gender * Games * Groups * Habit * Identity * Learning * Meaning * Memory * Motivation * Models * Needs * Personality * Power * Preferences * Research * Relationships * SIFT Model * Social Research * Stress * Trust * Values Theories * Alphabetic list * Theory types And – About – Guest Articles – Blog! – Books – Changes – Contact – Guestbook – Quotes – Students – Webmasters

A1: | Home | Top | Menu | Quick Links |

A1: function googleTranslateElementInit() { new google.translate.TranslateElement({pageLanguage: 'en'}, 'google_translate_element'); }