B1: How we change what others think, feel, believe and do

A1: | Menu | Quick | Books | Share | Search | Settings |

A1: Principles in analysis Explanations > Social Research > Analysis > Principles in analysis Comparing | Difference | Squaring | Proportion | Percentage | Ratio | See also There are several principles that appear across the many different analysis calculations. Averaging Given a set of measures of things which are the same in some way, the actual figures are likely to vary, due to other, differing factors. A simple way to summarize the set of measures is to average them (take the mean). The benefit of an average is that unusually low numbers are likely to cancel out unusually high numbers, resulting in the average being fairly central and hence an approximation of what you might expect the 'true measure' to be (if all other variation could be eliminated). Comparing Much analysis involves comparing two sets of figures to understand any difference between them. Typically, it is often important to know whether the two sets of figures are different in some way. Two types of people are different in some way. Treating a set of people changes them in some way (before-and-after tests). When there are a set of samples, it is common to compare the means (averages). For example the t-test compares the means of two sets of samples to determine whether there is a significant difference between them. Comparison is easiest when you do it in pairs, comparing A with B. Comparing can also be done for more than two groups at once, for example using ANOVA. Comparison can be used to analyze: A single set of measures (eg. comparing each measure against the mean). Two sets of measures A single set of measure against a standard, such as the Normal distribution. Comparing against a standard is useful because this allows additional meaning to be inferred and additional actions to be used. For example if a set of measures is found to be comparable with a Normal distribution then parametric analysis may be used. Difference A problem with comparing numbers is that they can be all over the place and meaning difficult to infer. A basic method of comparison is to subtract one number from another, thus highlighting a gap. This is done in two ways. First, an anchor point can be identified, and all other measures subtracted from this. For example with a single sample, each measure may be subtracted from the mean. A difference may also be used in a single formula, for example to highlight a gap between the averages of two sets of measures (and maybe hence show that the tow sets of figures are different). Where there are two matched sets of figures, then each number in one set can be subtracted from its corresponding number in the other set. The table below shows differences between a set of measures and its mean, and pairs of numbers. Squaring The problem with differences is that you get negative and positive numbers which, when summed will cancel one another out and may tend towards zero or otherwise be unrepresentative of the set of numbers. Summing is a part of averaging, and hence you cannot get a useful mean of a simple set of differences. Squaring the numbers before summing them is a useful way of making all the numbers positive. It also has the effect of exaggerating the larger numbers, which is no bad thing when bigger differences are more significant. The problem with squared numbers is that they are not the same as the original numbers, and can give strange units (what is years squared?). Numbers which are squared often subsequently have a square root applied to bring them back to the original unit and facilitate sense-making. The table below shows the effect of squaring and taking square roots of means and sums. Proportion There are two basic ways of comparing: subtracting (covered above) and dividing. We can thus say that my IQ is 75% of the population average (and hence is a good forecast). Thus you can show the proportion of a population or other 'total' with the simple division: Proportion = actual / total Another way of showing proportion is by dividing the difference between the first and second measure by the second measure: p = (x - y) / y For example if the the average IQ is 120 and my IQ is 90, then: p = (90 - 120) / 120 = -30 / 120 = -0.25 In other words, my IQ is 25% below average. This is used in the z-score, which converts measures into standard deviations: z = (x - s) / s Proportions are often expressed as percentages .Most people understand percentages intuitively and 90% or 25% has clear meaning. Percentage can also be expressed 'in reverse', with 90% also being expressed as 10%. It says the same thing, but can be used to make different emphasis. This form is calculated as: Percentage = (X - Y) / X Or, percentage = 1 - Y/X Notice how percentages neatly use both subtraction and division in a combined form of comparison. Ratio A further way of comparing by division is to divide two different items (such as 'fruit per tree') to give a new unit. This can then be used to compare 'apples and oranges' different things. This eliminates the problem of negatives that subtracting creates, although it can bring other problems in that the range of results can be huge (dividing by zero gives infinity). Ratios thus need to be treated with care (and is a reason why proportions are used, as these only range from 0 to 1 (or -1 to 1 if one number can be negative). The general Test Statistic typically uses a ratio based on the principle of comparing that which is expected and desirable with that which is unexpected and undesirable. Test statistic = systematic variance / unsystematic variance

B1: X | C1: X - x-bar | D1: Y | E1: X - Y
B3: 1 | C3: =B3-$B$14 -> -5.6 | D3: 4 | E3: =B3-D3 -> -3
B4: 10 | C4: =B4-$B$14 -> 3.4 | D4: 14 | E4: =B4-D4 -> -4
B5: 4 | C5: =B5-$B$14 -> -2.6 | D5: 10 | E5: =B5-D5 -> -6
B6: 6 | C6: =B6-$B$14 -> -0.6 | D6: 2 | E6: =B6-D6 -> 4
B7: 9 | C7: =B7-$B$14 -> 2.4 | D7: 7 | E7: =B7-D7 -> 2
B8: 2 | C8: =B8-$B$14 -> -4.6 | D8: 1 | E8: =B8-D8 -> 1
B9: 6 | C9: =B9-$B$14 -> -0.6 | D9: 13 | E9: =B9-D9 -> -7
B10: 19 | C10: =B10-$B$14 -> 12.4 | D10: 4 | E10: =B10-D10 -> 15
B11: 7 | C11: =B11-$B$14 -> 0.4 | D11: 0 | E11: =B11-D11 -> 7
B12: 2 | C12: =B12-$B$14 -> -4.6 | D12: 3 | E12: =B12-D12 -> -1
A14: Mean (x-bar) | B14: =AVERAGE(B3:B12) -> 6.6

B1: X | C1: X - x-bar | D1: (X - x-bar)^2 | E1: Y | F1: X - Y | G1: (X - Y)^2
B3: 1 | C3: =B3-$B$14 -> -5.6 | D3: =C3*C3 -> 31.36 | E3: 4 | F3: =B3-E3 -> -3 | G3: =F3*F3 -> 9.0
B4: 10 | C4: =B4-$B$14 -> 3.4 | D4: =C4*C4 -> 11.56 | E4: 14 | F4: =B4-E4 -> -4 | G4: =F4*F4 -> 16.0
B5: 4 | C5: =B5-$B$14 -> -2.6 | D5: =C5*C5 -> 6.76 | E5: 10 | F5: =B5-E5 -> -6 | G5: =F5*F5 -> 36.0
B6: 6 | C6: =B6-$B$14 -> -0.6 | D6: =C6*C6 -> 0.36 | E6: 2 | F6: =B6-E6 -> 4 | G6: =F6*F6 -> 16.0
B7: 9 | C7: =B7-$B$14 -> 2.4 | D7: =C7*C7 -> 5.76 | E7: 7 | F7: =B7-E7 -> 2 | G7: =F7*F7 -> 4.0
B8: 2 | C8: =B8-$B$14 -> -4.6 | D8: =C8*C8 -> 21.16 | E8: 1 | F8: =B8-E8 -> 1 | G8: =F8*F8 -> 1.0
B9: 6 | C9: =B9-$B$14 -> -0.6 | D9: =C9*C9 -> 0.36 | E9: 13 | F9: =B9-E9 -> -7 | G9: =F9*F9 -> 49.0
B10: 19 | C10: =B10-$B$14 -> 12.4 | D10: =C10*C10 -> 153.76 | E10: 4 | F10: =B10-E10 -> 15 | G10: =F10*F10 -> 225.0
B11: 7 | C11: =B11-$B$14 -> 0.4 | D11: =C11*C11 -> 0.16 | E11: 0 | F11: =B11-E11 -> 7 | G11: =F11*F11 -> 49.0
B12: 2 | C12: =B12-$B$14 -> -4.6 | D12: =C12*C12 -> 21.16 | E12: 3 | F12: =B12-E12 -> -1 | G12: =F12*F12 -> 1.0
A14: Mean (x-bar) | B14: =AVERAGE(B3:B12) -> 6.6 | C14: 0.0 | D14: =AVERAGE(D3:D12) -> 25.24 | E14: =AVERAGE(E3:E12) -> 5.8 | F14: =AVERAGE(F3:F12) -> 0.8 | G14: =AVERAGE(G3:G12) -> 40.6
A15: Square root | D15: =SQRT(D14) -> 5.0239426748321883 | G15: =SQRT(G14) -> 6.3718129288295966
A17: Sum | C17: =SUM(C3:C12) -> 0.0 | D17: =SUM(D3:D12) -> 252.4 | F17: =SUM(F3:F12) -> 8.0 | G17: =SUM(G3:G12) -> 406.0
A18: Square root | D18: =SQRT(D17) -> 15.8871016865884 | G18: =SQRT(G17) -> 20.149441679609886

A1: if (document.getElementById("tester") == undefined) { document.write('<p>&nbsp;</p><h3 align="center">To keep this site going, please allow adverts or donate</h3>'); document.write('<form action="https://www.paypal.com/cgi-bin/webscr" method="post" target="_top" align="center">'); document.write('<input type="hidden" name="cmd" value="_s-xclick">'); document.write('<input type="hidden" name="hosted_button_id" value="RHDQ3VJH93RDE">'); document.write('<input type="image" src="https://www.paypalobjects.com/en_US/GB/i/btn/btn_donateCC_LG.gif" border="0" name="submit" alt="PayPal ? The safer, easier way to pay online.">'); document.write('<img alt="" border="0" src="https://www.paypalobjects.com/en_GB/i/scr/pixel.gif" width="1" height="1">'); document.write('</form>'); } (adsbygoogle = window.adsbygoogle || []).push({});

A1: Site Menu
A2: | Home | Top | Quick Links | Settings |
A3: Main sections: | Disciplines | Techniques | Principles | Explanations | Theories |
A4: Other sections: | Blog! | Quotes | Guest articles | Analysis | Books | Help |
A5: More pages: | Contact | Caveat | About | Students | Webmasters | Awards | Guestbook | Feedback | Sitemap | Changes |
A6: Settings: | Computer layout | Mobile layout | Small font | Medium font | Large font | Translate |

A1: You can buy books here
A3: And the big paperback book

A1: More Kindle books:

A1: Look inside

A1: Please help and share:

A1: if (document.getElementById("tester") == undefined) { document.write('<p>&nbsp;</p><h3 align="center">To keep this site going, please allow adverts or donate</h3>'); document.write('<form action="https://www.paypal.com/cgi-bin/webscr" method="post" target="_top" align="center">'); document.write('<input type="hidden" name="cmd" value="_s-xclick">'); document.write('<input type="hidden" name="hosted_button_id" value="RHDQ3VJH93RDE">'); document.write('<input type="image" src="https://www.paypalobjects.com/en_US/GB/i/btn/btn_donateCC_LG.gif" border="0" name="submit" alt="PayPal ? The safer, easier way to pay online.">'); document.write('<img alt="" border="0" src="https://www.paypalobjects.com/en_GB/i/scr/pixel.gif" width="1" height="1">'); document.write('</form>'); } (adsbygoogle = window.adsbygoogle || []).push({});

A1: Quick links
A2: Disciplines * Argument * Brand management * Change Management * Coaching * Communication * Counseling * Game Design * Human Resources * Job-finding * Leadership * Marketing * Politics * Propaganda * Rhetoric * Negotiation * Psychoanalysis * Sales * Sociology * Storytelling * Teaching * Warfare * Workplace design Techniques * Assertiveness * Body language * Change techniques * Closing techniques * Conversation * Confidence tricks * Conversion * Creative techniques * General techniques * Happiness * Hypnotism * Interrogation * Language * Listening * Negotiation tactics * Objection handling * Propaganda * Problem-solving * Public speaking * Questioning * Using repetition * Resisting persuasion * Self-development * Sequential requests * Storytelling * Stress Management * Tipping * Using humor * Willpower | B2: Principles * Principles Explanations * Behaviors * Beliefs * Brain stuff * Conditioning * Coping Mechanisms * Critical Theory * Culture * Decisions * Emotions * Evolution * Gender * Games * Groups * Habit * Identity * Learning * Meaning * Memory * Motivation * Models * Needs * Personality * Power * Preferences * Research * Relationships * SIFT Model * Social Research * Stress * Trust * Values Theories * Alphabetic list * Theory types And – About – Guest Articles – Blog! – Books – Changes – Contact – Guestbook – Quotes – Students – Webmasters

A1: | Home | Top | Menu | Quick Links |

A1: function googleTranslateElementInit() { new google.translate.TranslateElement({pageLanguage: 'en'}, 'google_translate_element'); }

A1: if (document.getElementById("tester") == undefined) { document.write('<p>&nbsp;</p><h3 align="center">To keep this site going, please allow adverts or donate</h3>'); document.write('<form action="https://www.paypal.com/cgi-bin/webscr" method="post" target="_top" align="center">'); document.write('<input type="hidden" name="cmd" value="_s-xclick">'); document.write('<input type="hidden" name="hosted_button_id" value="RHDQ3VJH93RDE">'); document.write('<input type="image" src="https://www.paypalobjects.com/en_US/GB/i/btn/btn_donateCC_LG.gif" border="0" name="submit" alt="PayPal ? The safer, easier way to pay online.">'); document.write('<img alt="" border="0" src="https://www.paypalobjects.com/en_GB/i/scr/pixel.gif" width="1" height="1">'); document.write('</form>'); } (adsbygoogle = window.adsbygoogle || []).push({});

A1: Site Menu
A2: | Home | Top | Quick Links | Settings |
A3: Main sections: | Disciplines | Techniques | Principles | Explanations | Theories |
A4: Other sections: | Blog! | Quotes | Guest articles | Analysis | Books | Help |
A5: More pages: | Contact | Caveat | About | Students | Webmasters | Awards | Guestbook | Feedback | Sitemap | Changes |
A6: Settings: | Computer layout | Mobile layout | Small font | Medium font | Large font | Translate |

A1: Please help and share:

A1: if (document.getElementById("tester") == undefined) { document.write('<p>&nbsp;</p><h3 align="center">To keep this site going, please allow adverts or donate</h3>'); document.write('<form action="https://www.paypal.com/cgi-bin/webscr" method="post" target="_top" align="center">'); document.write('<input type="hidden" name="cmd" value="_s-xclick">'); document.write('<input type="hidden" name="hosted_button_id" value="RHDQ3VJH93RDE">'); document.write('<input type="image" src="https://www.paypalobjects.com/en_US/GB/i/btn/btn_donateCC_LG.gif" border="0" name="submit" alt="PayPal ? The safer, easier way to pay online.">'); document.write('<img alt="" border="0" src="https://www.paypalobjects.com/en_GB/i/scr/pixel.gif" width="1" height="1">'); document.write('</form>'); } (adsbygoogle = window.adsbygoogle || []).push({});

A1: Quick links
A2: Disciplines * Argument * Brand management * Change Management * Coaching * Communication * Counseling * Game Design * Human Resources * Job-finding * Leadership * Marketing * Politics * Propaganda * Rhetoric * Negotiation * Psychoanalysis * Sales * Sociology * Storytelling * Teaching * Warfare * Workplace design Techniques * Assertiveness * Body language * Change techniques * Closing techniques * Conversation * Confidence tricks * Conversion * Creative techniques * General techniques * Happiness * Hypnotism * Interrogation * Language * Listening * Negotiation tactics * Objection handling * Propaganda * Problem-solving * Public speaking * Questioning * Using repetition * Resisting persuasion * Self-development * Sequential requests * Storytelling * Stress Management * Tipping * Using humor * Willpower | B2: Principles + Principles Explanations * Behaviors * Beliefs * Brain stuff * Conditioning * Coping Mechanisms * Critical Theory * Culture * Decisions * Emotions * Evolution * Gender * Games * Groups * Habit * Identity * Learning * Meaning * Memory * Motivation * Models * Needs * Personality * Power * Preferences * Research * Relationships * SIFT Model * Social Research * Stress * Trust * Values Theories * Alphabetic list * Theory types And – About – Guest Articles – Blog! – Books – Changes – Contact – Guestbook – Quotes – Students – Webmasters

A1: | Home | Top | Menu | Quick Links |

A1: function googleTranslateElementInit() { new google.translate.TranslateElement({pageLanguage: 'en'}, 'google_translate_element'); }